{
  "vessel_id": "msc-bellissima",
  "deck_number": 4,
  "deck_name": "Lirica",
  "provenance": {
    "source_artifact": "MSC_BELLISSIMA_DECK_PLANS_11.2025_DEU",
    "evidence_page": 3,
    "extracted_at": "2026-08-18",
    "confidence": 0.947
  },
  "bounding_box": {
    "min_x": 40.0,
    "min_y": 40.0,
    "max_x": 980.0,
    "max_y": 260.0,
    "width": 940.0,
    "height": 220.0
  },
  "objects": [
    {
      "id": "LIFT-CORE-A-D04",
      "type": "LIFT",
      "label": "Forward Lift Core A",
      "category": "CIRCULATION_VERTICAL_CORE",
      "side": "CENTER",
      "polygon": [
        [
          740.0,
          130.0
        ],
        [
          768.0,
          130.0
        ],
        [
          768.0,
          168.0
        ],
        [
          740.0,
          168.0
        ]
      ],
      "centroid": {
        "x": 754.0,
        "y": 149.0
      },
      "door_position": {
        "x": 754.0,
        "y": 168.0
      },
      "orientation": "CENTER",
      "bounding_box": {
        "x": 740.0,
        "y": 130.0,
        "width": 28.0,
        "height": 38.0
      },
      "adjacent_objects": {
        "fore": null,
        "aft": null,
        "across": null,
        "corridor": "CENTRAL_CIRCULATION",
        "nearest_lift": null
      },
      "confidence": 0.96,
      "provenance_breakdown": {
        "polygon": "DIRECT",
        "centroid": "DERIVED",
        "bounding_box": "DERIVED",
        "orientation": "DIRECT",
        "door_position": "DIRECT",
        "adjacent_objects": "DERIVED"
      }
    },
    {
      "id": "LIFT-CORE-B-D04",
      "type": "LIFT",
      "label": "Midship Lift Core B",
      "category": "CIRCULATION_VERTICAL_CORE",
      "side": "CENTER",
      "polygon": [
        [
          490.0,
          130.0
        ],
        [
          518.0,
          130.0
        ],
        [
          518.0,
          168.0
        ],
        [
          490.0,
          168.0
        ]
      ],
      "centroid": {
        "x": 504.0,
        "y": 149.0
      },
      "door_position": {
        "x": 504.0,
        "y": 168.0
      },
      "orientation": "CENTER",
      "bounding_box": {
        "x": 490.0,
        "y": 130.0,
        "width": 28.0,
        "height": 38.0
      },
      "adjacent_objects": {
        "fore": null,
        "aft": null,
        "across": null,
        "corridor": "CENTRAL_CIRCULATION",
        "nearest_lift": null
      },
      "confidence": 0.96,
      "provenance_breakdown": {
        "polygon": "DIRECT",
        "centroid": "DERIVED",
        "bounding_box": "DERIVED",
        "orientation": "DIRECT",
        "door_position": "DIRECT",
        "adjacent_objects": "DERIVED"
      }
    },
    {
      "id": "LIFT-CORE-C-D04",
      "type": "LIFT",
      "label": "Aft Lift Core C",
      "category": "CIRCULATION_VERTICAL_CORE",
      "side": "CENTER",
      "polygon": [
        [
          230.0,
          130.0
        ],
        [
          258.0,
          130.0
        ],
        [
          258.0,
          168.0
        ],
        [
          230.0,
          168.0
        ]
      ],
      "centroid": {
        "x": 244.0,
        "y": 149.0
      },
      "door_position": {
        "x": 244.0,
        "y": 168.0
      },
      "orientation": "CENTER",
      "bounding_box": {
        "x": 230.0,
        "y": 130.0,
        "width": 28.0,
        "height": 38.0
      },
      "adjacent_objects": {
        "fore": null,
        "aft": null,
        "across": null,
        "corridor": "CENTRAL_CIRCULATION",
        "nearest_lift": null
      },
      "confidence": 0.96,
      "provenance_breakdown": {
        "polygon": "DIRECT",
        "centroid": "DERIVED",
        "bounding_box": "DERIVED",
        "orientation": "DIRECT",
        "door_position": "DIRECT",
        "adjacent_objects": "DERIVED"
      }
    },
    {
      "id": "LIFT-PANORAMIC-D04",
      "type": "LIFT",
      "label": "Atrium Panoramic Lifts",
      "category": "CIRCULATION_VERTICAL_CORE",
      "side": "PORT",
      "polygon": [
        [
          440.0,
          52.0
        ],
        [
          464.0,
          52.0
        ],
        [
          464.0,
          78.0
        ],
        [
          440.0,
          78.0
        ]
      ],
      "centroid": {
        "x": 452.0,
        "y": 65.0
      },
      "door_position": {
        "x": 452.0,
        "y": 78.0
      },
      "orientation": "CENTER",
      "bounding_box": {
        "x": 440.0,
        "y": 52.0,
        "width": 24.0,
        "height": 26.0
      },
      "adjacent_objects": {
        "fore": null,
        "aft": null,
        "across": null,
        "corridor": "CENTRAL_CIRCULATION",
        "nearest_lift": null
      },
      "confidence": 0.96,
      "provenance_breakdown": {
        "polygon": "DIRECT",
        "centroid": "DERIVED",
        "bounding_box": "DERIVED",
        "orientation": "DIRECT",
        "door_position": "DIRECT",
        "adjacent_objects": "DERIVED"
      }
    },
    {
      "id": "CORRIDOR-PORT-D04",
      "type": "CORRIDOR",
      "label": "Port Corridor Deck 4",
      "category": "CIRCULATION_CORRIDOR",
      "side": "PORT",
      "polygon": [
        [
          100.0,
          110.0
        ],
        [
          900.0,
          110.0
        ],
        [
          900.0,
          125.0
        ],
        [
          100.0,
          125.0
        ]
      ],
      "centroid": {
        "x": 500.0,
        "y": 117.5
      },
      "door_position": null,
      "orientation": "PORT",
      "bounding_box": {
        "x": 100.0,
        "y": 110.0,
        "width": 800.0,
        "height": 15.0
      },
      "adjacent_objects": {
        "fore": null,
        "aft": null,
        "across": "CORRIDOR-STARBOARD-D04",
        "corridor": null,
        "nearest_lift": "LIFT-CORE-B-D04"
      },
      "confidence": 0.92,
      "provenance_breakdown": {
        "polygon": "DIRECT",
        "centroid": "DERIVED",
        "bounding_box": "DERIVED",
        "orientation": "DERIVED",
        "door_position": "UNKNOWN",
        "adjacent_objects": "DERIVED"
      }
    },
    {
      "id": "CORRIDOR-STARBOARD-D04",
      "type": "CORRIDOR",
      "label": "Starboard Corridor Deck 4",
      "category": "CIRCULATION_CORRIDOR",
      "side": "STARBOARD",
      "polygon": [
        [
          100.0,
          175.0
        ],
        [
          900.0,
          175.0
        ],
        [
          900.0,
          190.0
        ],
        [
          100.0,
          190.0
        ]
      ],
      "centroid": {
        "x": 500.0,
        "y": 182.5
      },
      "door_position": null,
      "orientation": "STARBOARD",
      "bounding_box": {
        "x": 100.0,
        "y": 175.0,
        "width": 800.0,
        "height": 15.0
      },
      "adjacent_objects": {
        "fore": null,
        "aft": null,
        "across": "CORRIDOR-PORT-D04",
        "corridor": null,
        "nearest_lift": "LIFT-CORE-B-D04"
      },
      "confidence": 0.92,
      "provenance_breakdown": {
        "polygon": "DIRECT",
        "centroid": "DERIVED",
        "bounding_box": "DERIVED",
        "orientation": "DERIVED",
        "door_position": "UNKNOWN",
        "adjacent_objects": "DERIVED"
      }
    }
  ]
}